{
  "definitionId": "enterprise.event.collection_platform",
  "contentType": "event",
  "version": "1.0.0",
  "displayName": "采集平台残骸",
  "expansionId": "enterprise",
  "replaces": {
    "expansionId": "core",
    "contentType": "event",
    "definitionId": "event_red_03"
  },
  "artwork": "artwork/sheets/event_red_faces.jpg",
  "artworkSpriteId": "event_red_007",
  "tags": [
    "enterprise"
  ],
  "playerMarkerZones": [],
  "abilities": [
    {
      "abilityId": "enterprise.event.collection_platform.resolve",
      "mode": "resolve",
      "skillType": "normal",
      "subscriptionId": "content.enterprise.event.collection_platform.resolve",
      "script": "lua/events/enterprise.event.collection_platform.resolve.lua",
      "version": "1.0.0",
      "completionHandlerId": ""
    }
  ],
  "data": {
    "cardId": "event_red_03",
    "name": "采集平台残骸",
    "description": "你的队伍意外发现了惨遭天灾摧毁的采矿平台。它矗立在荒原上，如同无数死难者的纪念碑，这座平台上残留的异铁足够你再建一座区块了。这时，一些虚弱不堪的矿石病人从铁壳中爬出，他们是如何存活至今的？",
    "color": 2,
    "resourceType": 2,
    "resourceAmount": 1,
    "representativeResourceType": 2,
    "representativeResourceAmount": 1,
    "choiceDescriptions": [
      "安置幸存者：失去1分，选择同一家企业升级1级并触发特效",
      "搜寻更多幸存者：获得4源岩、3源石碎片",
      "继续回收：获得4异铁、5金券"
    ],
    "choiceRewards": [
      {
        "originium": 0,
        "originiumShard": 0,
        "iron": 0,
        "pureOriginium": 0,
        "goldVoucher": 0
      },
      {
        "originium": 4,
        "originiumShard": 3,
        "iron": 0,
        "pureOriginium": 0,
        "goldVoucher": 0
      },
      {
        "originium": 0,
        "originiumShard": 0,
        "iron": 4,
        "pureOriginium": 0,
        "goldVoucher": 5
      }
    ],
    "choicePendingEffects": [
      [],
      [],
      []
    ],
    "effectScript": "lua/events/enterprise.event.collection_platform.resolve.lua"
  }
}
