{
  "definitionId": "building_030",
  "contentType": "facility",
  "version": "1.0.0",
  "displayName": "开采电铲",
  "artwork": "artwork/facility/building_030.jpg",
  "tags": [],
  "playerMarkerZones": [],
  "abilities": [],
  "data": {
    "facilityId": "building_030",
    "manifestId": "building_030"
  },
  "expansionId": "core",
  "replaces": null,
  "dataTemplate": "templates/facilities/choose_five_basic_resources.json"
}
