{
  "definitionId": "building_033",
  "contentType": "facility",
  "version": "1.0.0",
  "displayName": "固源岩提纯厂",
  "artwork": "artwork/facility/building_033.jpg",
  "tags": [],
  "playerMarkerZones": [],
  "abilities": [],
  "data": {
    "facilityId": "building_033",
    "manifestId": "building_033",
    "color": "red"
  },
  "expansionId": "core",
  "replaces": null,
  "dataTemplate": "templates/facilities/gain_originium_7.json"
}
