{
  "definitionId": "reserve_004",
  "contentType": "facility",
  "version": "1.0.0",
  "displayName": "延伸枢纽",
  "artwork": "artwork/facility/reserve_004.jpg",
  "tags": [],
  "playerMarkerZones": [],
  "abilities": [],
  "data": {
    "facilityId": "reserve_004",
    "manifestId": "reserve_004",
    "color": "red"
  },
  "expansionId": "core",
  "replaces": null,
  "dataTemplate": "templates/facilities/reserve_extension_hub.json"
}
