{
  "definitionId": "building_020",
  "contentType": "facility",
  "version": "1.0.0",
  "displayName": "贸易街区",
  "artwork": "artwork/facility/building_020.jpg",
  "tags": [],
  "playerMarkerZones": [],
  "abilities": [],
  "data": {
    "facilityId": "building_020",
    "manifestId": "building_020"
  },
  "expansionId": "core",
  "replaces": null,
  "dataTemplate": "templates/facilities/sell_resources.json"
}
