{
  "definitionId": "building_011",
  "contentType": "facility",
  "version": "1.0.0",
  "displayName": "简陋工程营",
  "artwork": "artwork/facility/building_011.jpg",
  "tags": [],
  "playerMarkerZones": [],
  "abilities": [],
  "data": {
    "facilityId": "building_011",
    "manifestId": "building_011"
  },
  "expansionId": "core",
  "replaces": null,
  "dataTemplate": "templates/facilities/build_additional_facility.json"
}
