{
  "definitionId": "city_style_large_enterprise_park",
  "contentType": "city_style",
  "version": "1.1.0",
  "displayName": "大型企业园",
  "expansionId": "enterprise",
  "replaces": null,
  "artwork": "artwork/sheets/city_style_level_1.jpg",
  "artworkSpriteId": "city_style_1_008",
  "tags": [
    "enterprise"
  ],
  "playerMarkerZones": [],
  "abilities": [
    {
      "abilityId": "city_style_large_enterprise_park.special",
      "mode": "special",
      "skillType": "normal",
      "subscriptionId": "content.city_style_large_enterprise_park.special",
      "script": "lua/city_styles/city_style_large_enterprise_park.special.lua",
      "version": "1.0.0",
      "completionHandlerId": ""
    }
  ],
  "data": {
    "cityStyleId": "city_style_large_enterprise_park",
    "name": "大型企业园",
    "level": 1,
    "score": 3,
    "description": "选择1家企业，连续提升2级合作等级。",
    "maxDeclarationsPerPlayer": 2147483647,
    "specialActionId": "special_action.city_style.large_enterprise_park",
    "declarationReward": {
      "originium": 0,
      "originiumShard": 0,
      "iron": 0,
      "pureOriginium": 0,
      "goldVoucher": 0
    },
    "declarationRequirement": {
      "requiredFacilityCount": 3,
      "requiredPatternCells": [
        {
          "rowOffset": 0,
          "columnOffset": 0,
          "allowedFacilityColors": [
            "blue"
          ]
        },
        {
          "rowOffset": 1,
          "columnOffset": 0,
          "allowedFacilityColors": [
            "red"
          ]
        },
        {
          "rowOffset": 1,
          "columnOffset": 1,
          "allowedFacilityColors": [
            "blue"
          ]
        }
      ]
    },
    "specialAction": {
      "specialActionId": "special_action.city_style.large_enterprise_park",
      "cityStyleId": "city_style_large_enterprise_park",
      "name": "大型企业园",
      "description": "选择1家企业，连续提升2级合作等级。",
      "level": 1,
      "effectKind": 3,
      "fixedCost": {
        "originium": 0,
        "originiumShard": 0,
        "iron": 0,
        "pureOriginium": 0,
        "goldVoucher": 0
      },
      "flexibleOriginiumAndIronCost": 0,
      "maximumTargetCount": 0,
      "freeMoveCount": 0,
      "extraMainActionCount": 0,
      "locksCharacterCard": false
    },
    "luaSubscriptionId": "content.city_style_large_enterprise_park.special",
    "luaAbilityId": "city_style_large_enterprise_park.special",
    "luaCompletionHandlerId": "",
    "luaVersion": "1.0.0",
    "effectScript": "lua/city_styles/city_style_large_enterprise_park.special.lua"
  },
  "abilitySources": [
    {
      "protocolVersion": 1,
      "abilityId": "city_style_large_enterprise_park.special",
      "kind": "special",
      "handlerRef": "content.city_style_large_enterprise_park.special",
      "declarationVersion": "1.0.0",
      "authorizationPolicy": "public_declaration",
      "effectiveZones": [
        "core.zone.city_style_display"
      ],
      "activeFaceId": "",
      "observedEvents": [],
      "queryKinds": [],
      "allowedOperations": [],
      "presentationRef": "city_style_large_enterprise_park",
      "actions": [
        {
          "actionId": "special_action.city_style.large_enterprise_park",
          "entryKind": "special",
          "bodyHandlerRef": "content.city_style_large_enterprise_park.special",
          "entryCostRef": "",
          "entryAfterEffectsRef": "",
          "usageTrackId": "usage.city_style_large_enterprise_park",
          "lifecyclePolicy": "unbounded",
          "lockPolicy": "none",
          "directCallPolicy": "host.legacy_style.v1",
          "sortOrder": 200,
          "presentationRef": "city_style_large_enterprise_park"
        }
      ]
    }
  ],
  "abilityHandlers": [
    {
      "handlerId": "content.city_style_large_enterprise_park.special",
      "script": "lua/city_styles/city_style_large_enterprise_park.special.lua",
      "version": "1.0.0",
      "completionHandlerId": ""
    }
  ],
  "usageTracks": [
    {
      "protocolVersion": 1,
      "version": "1.0.0",
      "trackId": "usage.city_style_large_enterprise_park",
      "cardZoneLocalId": "usage",
      "slots": [
        "declared",
        "unused",
        "used",
        "2",
        "1",
        "0",
        "used_from_2",
        "used_from_1"
      ],
      "initialSlotId": "unused",
      "activationTransitions": [
        {
          "fromSlotId": "unused",
          "toSlotId": "used"
        }
      ],
      "resetTransitions": [
        {
          "fromSlotId": "used",
          "toSlotId": "unused"
        }
      ],
      "resetBoundary": "all_cleanup_completed",
      "initializationPolicy": "public_declaration",
      "usageGroupScope": "source_player_round"
    }
  ],
  "cardZones": [
    {
      "localZoneId": "usage",
      "zoneTemplateId": "core.zone.board_marker_track",
      "slots": [
        "declared",
        "unused",
        "used",
        "2",
        "1",
        "0",
        "used_from_2",
        "used_from_1"
      ],
      "acceptedItemKinds": [
        "Cube"
      ],
      "acceptedTypeIds": [
        "core.player_marker"
      ],
      "entryPolicyId": "core.explicit_transfer",
      "exitPolicyId": "core.explicit_transfer",
      "capacityPolicy": "bounded",
      "capacity": 1,
      "orderingKind": "Track",
      "visibilityPolicyId": "core.public_items",
      "carrierExitPolicyId": "core.preserve_contents"
    }
  ]
}
