{
  "definitionId": "building_032",
  "contentType": "facility",
  "version": "1.0.0",
  "displayName": "异铁冶炼厂",
  "artwork": "artwork/facility/building_032.jpg",
  "tags": [],
  "playerMarkerZones": [],
  "abilities": [],
  "data": {
    "facilityId": "building_032",
    "manifestId": "building_032",
    "color": "red"
  },
  "expansionId": "core",
  "replaces": null,
  "dataTemplate": "templates/facilities/gain_iron_4.json"
}
